ID,Username,Password,Email,Name,Mobile Number,Role
41,hawkinsjulie,Generation report tough rise address old beyond. Tv staff will run near why however. Reveal listen speak board growth.,cynthia77@example.org,Make after commercial reduce who vote score. Special sort concern until through.,Huge follow.,client
42,usandoval,Finish sell which million. Remain stuff bad dinner when. Into career church.,davidaguilar@example.net,Run leave candidate. During trouble wind senior building think.,Pass kid.,client
43,jonathanbarrett,Program these guy. Side suggest blue ahead question factor war.,ybrooks@example.com,Drop example somebody forward. Century morning join wall. Seat resource significant air event management wrong including.,Hard change.,contract
44,ncross,"Majority head sea open girl important with.
Economy whole apply hard.
Help within open knowledge.",jacqueline67@example.net,Area contain let national yard. Often simply sound yes laugh organization a team. Edge event medical.,Front prevent.,client
45,costastephanie,Generation significant wrong provide. As seek kind management present.,brian80@example.net,Pressure most sound enjoy. Purpose such gas defense sport. Arrive development stuff process.,Without.,client
46,adam50,Carry theory their middle key. Question speech oil pick economic. Natural energy industry probably various rich everyone.,kevin42@example.com,Attack recent science under significant. Wish American away try. Trouble final strategy more data.,Investment.,client
47,mcfarlanderic,Research coach maintain key. Hundred southern read reach recent service.,patrick63@example.net,Man run certainly interest society success animal alone. Talk explain true rest. Learn although you audience.,Why century.,client
48,achambers,Number might officer when. Area center win hour.,gcolon@example.com,Common mention health through movement happen reduce radio.,Perform life.,client
49,gloverjames,We democratic one. Pm Democrat how son.,april61@example.net,Least large trip black season soon late. Pattern after field. Message me ground central baby while rich movie.,Major cause.,fulltime
50,williamsonwilliam,"Least make response remember director.
Several factor which sea. Save director situation with.",amanda14@example.com,Film throughout dark almost agency number fine. Republican candidate movie each. Quickly threat find political.,Court adult.,client
51,pamelamccann,"South anything respond put high.
Make this foreign begin save lay. Level plant pay rate. Bit news too good.",darius00@example.net,Stuff arrive sound score. Serve capital and guess hear center discussion. Edge whose year peace explain. Record analysis direction most ok detail.,Campaign.,client
52,plyons,Science shake half result speech. Whether produce method material child nature. Indicate property heavy shake detail.,snowcarl@example.net,Spring table big half. Know provide then. Any field join alone let including together. Herself story crime often.,Which hold boy.,fulltime
53,norman12,Increase medical energy Mr evening price follow. Challenge look political figure speak. Democrat rise player pass.,hhaynes@example.net,"Commercial of project possible character less.
Cost recognize each but.
Place drive pretty finish yeah. Simply line wrong market respond.",Ground along.,contract
54,acevedoamanda,You within energy prevent camera somebody this prepare.,powelljoseph@example.net,"Cause best least eat.
Country deep father peace approach fish course. Rest officer by himself open concern her item. Picture defense certainly.",These possible.,contract
55,jeremiahmunoz,"Nearly nature deep feel. State provide bit recognize.
Act eye serve the some. Prove without less decision half.",olivererika@example.org,"Seek suddenly people need range run. Offer follow military certain star bit.
Commercial father keep full method. Clear air human like just get hand.",My arm decade.,fulltime
56,warrenaustin,Recognize say response more. She green station season point good try. Several should paper the relate painting newspaper.,martinezlindsey@example.org,"Dinner current decade make action use.
Since whatever class evidence million.",Explain.,contract
57,gallowayjonathan,Suffer after hot hear increase beyond career. Get up such cell.,garciachristopher@example.net,Commercial campaign hand agency offer star. This guess hard relationship hot mouth.,Street.,fulltime
58,corteznatalie,Street can newspaper accept. Democrat according cup interesting around everybody sea themselves.,bsanchez@example.com,Girl be move wide option commercial magazine. Guess toward yet big.,Century matter.,client
59,mary98,With fill lot he improve. Speech process lawyer individual. Between term prepare laugh program.,lopezmegan@example.com,Poor citizen low red wear next former. Song PM much coach gun key none house.,Enough also.,contract
60,dwilliams,Blood believe effect tend view.,jrodriguez@example.net,High morning result bank any. Early water develop resource. International view get eight speech build.,So wife feel.,client
61,joyce52,Number direction sing word collection system. And agree free south whole gas.,rallen@example.net,Reflect large chair movie month return. Morning mouth that campaign meet. Player product woman its.,Program your.,fulltime
62,zacharyfischer,Face pretty so join realize determine end theory. Room president physical road before rest age.,aaron35@example.com,Push picture recent apply market. Traditional industry understand home.,Conference.,contract
63,schmidtmaria,Lay surface especially at draw image. Brother fly along amount out stock success. Try share west church.,kramertyler@example.net,Say debate begin collection. Chance wind region appear effect test decide natural.,Husband early.,fulltime
64,riveralaura,Affect film entire week play test. Whose piece whom mention account issue. Head letter account.,andrew17@example.com,Beat myself read just pull. Exactly mission station top pass establish although. Garden necessary painting anything argue bank.,Together form.,client
65,johnadkins,Tonight Mrs analysis. History the job I buy both.,laura15@example.net,"Fight even message explain. Leader do source save country then.
Effort worker take herself. Campaign research sport quality study sell.",Executive.,client
66,elijah39,"Positive make ball affect industry yeah under.
His thousand because. Like almost policy the.",alexanderweaver@example.org,Page away level care. Better put world network production wife.,Money someone.,client
67,mreilly,Tend future modern evening often suffer. Side yet send many explain others game.,ustrong@example.com,Always us point city number down. Himself help section would machine.,Keep may.,contract
68,denise70,Yet former machine statement Republican. Partner few top else daughter approach general.,cindyanderson@example.com,Family though minute modern wonder pressure in. Follow open meet cold laugh them. Interesting challenge argue five professor lot main mean.,Whole daughter.,fulltime
69,barnettscott,Work college international green safe media. Toward build hear find.,ganderson@example.org,Daughter argue begin station. Paper detail Mrs others which step. Window claim present crime cover.,Likely.,client
70,brandonhill,Learn participant sea discuss difference firm yes. Public chair fight prevent worry.,phillipsnicole@example.net,"Civil citizen improve amount. Well herself focus ahead.
Wrong half not put share thousand agree. Mention shoulder everything do develop field.",Deal computer.,client
71,christinemorgan,Because article common base join. General Mr painting firm main wall. World across assume tough. Hope face lawyer forget.,guzmanevan@example.com,Sell assume check book deep report base. Pressure join picture fear.,Interest book.,client
72,harrisemily,Certainly until step store word hair offer. National bring couple and along. Player difficult may Democrat yourself.,rogersmartha@example.net,South particularly tax condition. Itself we drug quickly you. Appear career heart low interview want society. Hundred else away meeting call.,When sort.,contract
73,sandrastewart,Focus change surface table. Glass drop see staff lose however technology.,kmartinez@example.com,"Support method thank run. Pattern child future.
Star sea race provide. Among game itself child once human statement production.",Check where.,fulltime
74,vthomas,Dog option soon difference reduce. Drop into agent with protect.,clineanthony@example.net,Evidence hundred western contain concern. Have majority establish while live product whether. Republican trial dinner until ground race want.,Despite road.,contract
75,yturner,Draw interesting sing let where. Almost choice though one performance again defense. Better stay receive those.,danderson@example.org,Bring continue pattern. Head past win green benefit hand radio move.,Heart week.,contract
76,rrhodes,Him water ground. Word majority character Mrs.,jason19@example.org,Course kind building can suggest health type material. Role dog follow every outside stuff. Type hit place billion coach while song.,Go top state.,contract
77,esmith,Social mother democratic available. Reflect debate condition day cup deep. Idea movement bag together my technology great.,melissa97@example.org,For hard leader since catch. Care foreign scene partner. Alone direction mention.,A sure many.,client
78,yhopkins,Usually certain much. Food argue few look raise.,oscar49@example.net,Picture several type. Else east significant population may. Name daughter move reach maybe.,According.,fulltime
79,marie13,Language prove hope deep different. Tax until book big often.,helenkoch@example.com,She send feeling baby follow because. Law officer trial current next continue north law. Customer dinner young family cultural.,Official.,client
80,alicia68,Hand of real listen manage. Yet democratic eight never ten visit. Fact foreign month mean walk exactly.,heather81@example.org,Begin near family leader. Dream whom full. Down loss stay rest current.,Hear hot.,fulltime
